[
  {
    "id": "village-hero",
    "alt": "Toan canh phong canh lang que Me Linh, Ha Noi.",
    "width": 1440,
    "height": 1080,
    "focalPoint": { "x": 0.5, "y": 0.58 },
    "sources": {
      "webp": {
        "640": "/assets/village-hero-640.webp",
        "960": "/assets/village-hero-960.webp",
        "1440": "/assets/village-hero-1440.webp",
        "1920": "/assets/village-hero-1920.webp"
      }
    },
    "variants": {
      "hero-home": { "sources": { "webp": { "640": "/assets/village-hero-hero-home-640.webp", "960": "/assets/village-hero-hero-home-960.webp", "1440": "/assets/village-hero-hero-home-1440.webp", "1920": "/assets/village-hero-hero-home-1920.webp" } } },
      "hero-water": { "sources": { "webp": { "640": "/assets/village-hero-hero-water-640.webp", "960": "/assets/village-hero-hero-water-960.webp", "1440": "/assets/village-hero-hero-water-1440.webp", "1920": "/assets/village-hero-hero-water-1920.webp" } } },
      "hero-road": { "sources": { "webp": { "640": "/assets/village-hero-hero-road-640.webp", "960": "/assets/village-hero-hero-road-960.webp", "1440": "/assets/village-hero-hero-road-1440.webp", "1920": "/assets/village-hero-hero-road-1920.webp" } } },
      "hero-field": { "sources": { "webp": { "640": "/assets/village-hero-hero-field-640.webp", "960": "/assets/village-hero-hero-field-960.webp", "1440": "/assets/village-hero-hero-field-1440.webp", "1920": "/assets/village-hero-hero-field-1920.webp" } } },
      "story-message": { "sources": { "webp": { "640": "/assets/village-hero-story-message-640.webp", "960": "/assets/village-hero-story-message-960.webp", "1440": "/assets/village-hero-story-message-1440.webp", "1920": "/assets/village-hero-story-message-1920.webp" } } },
      "gallery-mono": { "sources": { "webp": { "640": "/assets/village-hero-gallery-mono-640.webp", "960": "/assets/village-hero-gallery-mono-960.webp", "1440": "/assets/village-hero-gallery-mono-1440.webp", "1920": "/assets/village-hero-gallery-mono-1920.webp" } } },
      "gallery-vivid": { "sources": { "webp": { "640": "/assets/village-hero-gallery-vivid-640.webp", "960": "/assets/village-hero-gallery-vivid-960.webp", "1440": "/assets/village-hero-gallery-vivid-1440.webp", "1920": "/assets/village-hero-gallery-vivid-1920.webp" } } },
      "gallery-warm": { "sources": { "webp": { "640": "/assets/village-hero-gallery-warm-640.webp", "960": "/assets/village-hero-gallery-warm-960.webp", "1440": "/assets/village-hero-gallery-warm-1440.webp", "1920": "/assets/village-hero-gallery-warm-1920.webp" } } },
      "archive-default": { "sources": { "webp": { "640": "/assets/village-hero-archive-default-640.webp", "960": "/assets/village-hero-archive-default-960.webp", "1440": "/assets/village-hero-archive-default-1440.webp", "1920": "/assets/village-hero-archive-default-1920.webp" } } },
      "archive-muted": { "sources": { "webp": { "640": "/assets/village-hero-archive-muted-640.webp", "960": "/assets/village-hero-archive-muted-960.webp", "1440": "/assets/village-hero-archive-muted-1440.webp", "1920": "/assets/village-hero-archive-muted-1920.webp" } } },
      "archive-warm": { "sources": { "webp": { "640": "/assets/village-hero-archive-warm-640.webp", "960": "/assets/village-hero-archive-warm-960.webp", "1440": "/assets/village-hero-archive-warm-1440.webp", "1920": "/assets/village-hero-archive-warm-1920.webp" } } },
      "archive-vivid": { "sources": { "webp": { "640": "/assets/village-hero-archive-vivid-640.webp", "960": "/assets/village-hero-archive-vivid-960.webp", "1440": "/assets/village-hero-archive-vivid-1440.webp", "1920": "/assets/village-hero-archive-vivid-1920.webp" } } },
      "update-soft": { "sources": { "webp": { "640": "/assets/village-hero-update-soft-640.webp", "960": "/assets/village-hero-update-soft-960.webp", "1440": "/assets/village-hero-update-soft-1440.webp", "1920": "/assets/village-hero-update-soft-1920.webp" } } },
      "update-mono": { "sources": { "webp": { "640": "/assets/village-hero-update-mono-640.webp", "960": "/assets/village-hero-update-mono-960.webp", "1440": "/assets/village-hero-update-mono-1440.webp", "1920": "/assets/village-hero-update-mono-1920.webp" } } },
      "update-vivid": { "sources": { "webp": { "640": "/assets/village-hero-update-vivid-640.webp", "960": "/assets/village-hero-update-vivid-960.webp", "1440": "/assets/village-hero-update-vivid-1440.webp", "1920": "/assets/village-hero-update-vivid-1920.webp" } } },
      "update-warm": { "sources": { "webp": { "640": "/assets/village-hero-update-warm-640.webp", "960": "/assets/village-hero-update-warm-960.webp", "1440": "/assets/village-hero-update-warm-1440.webp", "1920": "/assets/village-hero-update-warm-1920.webp" } } }
    },
    "placeholder": "#2a3b33",
    "version": "20260804"
  },
  {
    "id": "camp-gate-whole",
    "alt": "Cổng trại Chi đội Thôn 3 Hạ Lôi.",
    "width": 1341,
    "height": 1173,
    "focalPoint": { "x": 0.5, "y": 0.5 },
    "sources": {
      "avif": {
        "640": "/assets/camp-gate-thon3-v5-640.avif",
        "960": "/assets/camp-gate-thon3-v5-960.avif",
        "1440": "/assets/camp-gate-thon3-v5-1440.avif",
        "1920": "/assets/camp-gate-thon3-v5-1920.avif"
      },
      "webp": {
        "640": "/assets/camp-gate-thon3-v5-640.webp",
        "960": "/assets/camp-gate-thon3-v5-960.webp",
        "1440": "/assets/camp-gate-thon3-v5-1440.webp",
        "1920": "/assets/camp-gate-thon3-v5-1920.webp"
      }
    },
    "placeholder": "#eef3ef",
    "version": "20260821"
  },
  {
    "id": "camp-gate-user-cutout",
    "alt": "Cổng trại Chi đội Thôn 3 Hạ Lôi.",
    "width": 1340,
    "height": 1174,
    "focalPoint": { "x": 0.5, "y": 0.5 },
    "sources": {
      "avif": {
        "640": "/assets/camp-gate-thon3-user-cutout-640.avif",
        "960": "/assets/camp-gate-thon3-user-cutout-960.avif",
        "1440": "/assets/camp-gate-thon3-user-cutout-1440.avif",
        "1920": "/assets/camp-gate-thon3-user-cutout-1920.avif"
      },
      "webp": {
        "640": "/assets/camp-gate-thon3-user-cutout-640.webp",
        "960": "/assets/camp-gate-thon3-user-cutout-960.webp",
        "1440": "/assets/camp-gate-thon3-user-cutout-1440.webp",
        "1920": "/assets/camp-gate-thon3-user-cutout-1920.webp"
      }
    },
    "placeholder": "#eef3ef",
    "version": "20260822"
  },
  {
    "id": "camp-gate-left",
    "alt": "Cánh trái cổng trại Chi đội Thôn 3 Hạ Lôi.",
    "width": 1536,
    "height": 1024,
    "focalPoint": { "x": 0.27, "y": 0.5 },
    "sources": {
      "avif": {
        "640": "/assets/camp-gate-left-v3-640.avif",
        "960": "/assets/camp-gate-left-v3-960.avif",
        "1440": "/assets/camp-gate-left-v3-1440.avif",
        "1920": "/assets/camp-gate-left-v3-1920.avif"
      },
      "webp": {
        "640": "/assets/camp-gate-left-v3-640.webp",
        "960": "/assets/camp-gate-left-v3-960.webp",
        "1440": "/assets/camp-gate-left-v3-1440.webp",
        "1920": "/assets/camp-gate-left-v3-1920.webp"
      }
    },
    "placeholder": "#eef3ef",
    "version": "20260821"
  },
  {
    "id": "camp-gate-right",
    "alt": "Cánh phải cổng trại Chi đội Thôn 3 Hạ Lôi.",
    "width": 1024,
    "height": 1536,
    "focalPoint": { "x": 0.5, "y": 0.5 },
    "sources": {
      "avif": {
        "640": "/assets/camp-gate-right-v3-640.avif",
        "960": "/assets/camp-gate-right-v3-960.avif",
        "1440": "/assets/camp-gate-right-v3-1440.avif",
        "1920": "/assets/camp-gate-right-v3-1920.avif"
      },
      "webp": {
        "640": "/assets/camp-gate-right-v3-640.webp",
        "960": "/assets/camp-gate-right-v3-960.webp",
        "1440": "/assets/camp-gate-right-v3-1440.webp",
        "1920": "/assets/camp-gate-right-v3-1920.webp"
      }
    },
    "placeholder": "#eef3ef",
    "version": "20260821"
  },
  {
    "id": "camp-gate-top",
    "alt": "Phần mái cổng trại Chi đội Thôn 3 Hạ Lôi.",
    "width": 1983,
    "height": 793,
    "focalPoint": { "x": 0.5, "y": 0.5 },
    "sources": {
      "avif": {
        "640": "/assets/camp-gate-top-v3-640.avif",
        "960": "/assets/camp-gate-top-v3-960.avif",
        "1440": "/assets/camp-gate-top-v3-1440.avif",
        "1920": "/assets/camp-gate-top-v3-1920.avif"
      },
      "webp": {
        "640": "/assets/camp-gate-top-v3-640.webp",
        "960": "/assets/camp-gate-top-v3-960.webp",
        "1440": "/assets/camp-gate-top-v3-1440.webp",
        "1920": "/assets/camp-gate-top-v3-1920.webp"
      }
    },
    "placeholder": "#eef3ef",
    "version": "20260821"
  }
]
